{
  "$schema": "../schema/inventory.schema.json",
  "engineVariantId": "2jz-ge-vvti-jzs160",
  "revision": 1,
  "units": "metres",
  "frame": "See content/engines/2jz-ge-vvti-jzs160.json#frame",
  "summary": "Service-relevant components for the timing-belt procedure, plus orientation context. Every dimension and placement is an estimate from photograph proportions scaled to the published 86 mm bore. No component is measured, fitment-confirmed or reviewed.",
  "components": [
    {
      "id": "cylinder-block",
      "name": "Cylinder block",
      "description": "Shown as an orientation volume. Internal passages, ribs and mounts are not modeled.",
      "system": "engine-structure",
      "parentId": null,
      "kind": "assembly",
      "quantity": {
        "value": 1,
        "status": "photographic",
        "sourceIds": [
          "photo-us-gs300-bay",
          "lexus-uk-vvti-cutaway"
        ]
      },
      "applicability": {
        "configurationIds": [
          "lexus-gs300-jzs160-2000-us-lhd"
        ],
        "engineVariantIds": [
          "2jz-ge-vvti-jzs160"
        ]
      },
      "oemPartNumber": {
        "value": null,
        "status": "not-established",
        "sourceIds": [
          "lexus-epc"
        ]
      },
      "dimensions": {
        "status": "estimated",
        "sourceIds": [
          "wrenchwise-layout-estimate",
          "lexus-uk-gs300-1997-spec"
        ],
        "items": [
          {
            "key": "length",
            "value": 0.6,
            "unit": "m",
            "method": "photo-proportion"
          },
          {
            "key": "width",
            "value": 0.36,
            "unit": "m",
            "method": "photo-proportion"
          },
          {
            "key": "height",
            "value": 0.395,
            "unit": "m",
            "method": "photo-proportion"
          }
        ]
      },
      "placement": {
        "status": "estimated",
        "frame": "engine",
        "position": [
          0,
          0.077,
          -0.3
        ],
        "axis": "z",
        "sourceIds": [
          "wrenchwise-layout-estimate"
        ]
      },
      "asset": {
        "layer": "core",
        "meshIds": [
          "cylinder-block"
        ]
      },
      "procedureStepIds": [],
      "sourceIds": [
        "photo-us-gs300-bay",
        "lexus-uk-vvti-cutaway",
        "wrenchwise-layout-estimate"
      ],
      "verification": {
        "identity": {
          "status": "photographic",
          "sourceIds": [
            "photo-us-gs300-bay",
            "lexus-uk-vvti-cutaway"
          ]
        },
        "dimensions": {
          "status": "estimated",
          "sourceIds": [
            "wrenchwise-layout-estimate"
          ]
        },
        "placement": {
          "status": "estimated",
          "sourceIds": [
            "wrenchwise-layout-estimate"
          ]
        },
        "fitment": {
          "status": "not-established",
          "sourceIds": []
        },
        "procedure": {
          "status": "not-applicable",
          "sourceIds": []
        }
      },
      "gaps": [
        "Casting shape, mounting bosses and bore spacing are not modeled."
      ]
    },
    {
      "id": "oil-pan",
      "name": "Oil pan",
      "description": "Orientation volume.",
      "system": "engine-structure",
      "parentId": "cylinder-block",
      "kind": "assembly",
      "quantity": {
        "value": 1,
        "status": "photographic",
        "sourceIds": [
          "lexus-uk-vvti-cutaway"
        ]
      },
      "applicability": {
        "configurationIds": [
          "lexus-gs300-jzs160-2000-us-lhd"
        ],
        "engineVariantIds": [
          "2jz-ge-vvti-jzs160"
        ]
      },
      "oemPartNumber": {
        "value": null,
        "status": "not-established",
        "sourceIds": [
          "lexus-epc"
        ]
      },
      "dimensions": {
        "status": "estimated",
        "sourceIds": [
          "wrenchwise-layout-estimate",
          "lexus-uk-gs300-1997-spec"
        ],
        "items": [
          {
            "key": "length",
            "value": 0.58,
            "unit": "m",
            "method": "photo-proportion"
          },
          {
            "key": "width",
            "value": 0.3,
            "unit": "m",
            "method": "photo-proportion"
          },
          {
            "key": "height",
            "value": 0.13,
            "unit": "m",
            "method": "photo-proportion"
          }
        ]
      },
      "placement": {
        "status": "estimated",
        "frame": "engine",
        "position": [
          0,
          -0.185,
          -0.31
        ],
        "axis": "z",
        "sourceIds": [
          "wrenchwise-layout-estimate"
        ]
      },
      "asset": {
        "layer": "core",
        "meshIds": [
          "oil-pan"
        ]
      },
      "procedureStepIds": [],
      "sourceIds": [
        "lexus-uk-vvti-cutaway",
        "wrenchwise-layout-estimate"
      ],
      "verification": {
        "identity": {
          "status": "photographic",
          "sourceIds": [
            "lexus-uk-vvti-cutaway"
          ]
        },
        "dimensions": {
          "status": "estimated",
          "sourceIds": [
            "wrenchwise-layout-estimate"
          ]
        },
        "placement": {
          "status": "estimated",
          "sourceIds": [
            "wrenchwise-layout-estimate"
          ]
        },
        "fitment": {
          "status": "not-established",
          "sourceIds": []
        },
        "procedure": {
          "status": "not-applicable",
          "sourceIds": []
        }
      },
      "gaps": [
        "Upper/lower pan split not represented."
      ]
    },
    {
      "id": "cylinder-head",
      "name": "Cylinder head",
      "description": "Carries the intake and exhaust camshafts. Shown as an orientation volume with camshaft nose bosses.",
      "system": "engine-structure",
      "parentId": "cylinder-block",
      "kind": "assembly",
      "quantity": {
        "value": 1,
        "status": "photographic",
        "sourceIds": [
          "photo-us-gs300-bay",
          "lexus-uk-vvti-cutaway"
        ]
      },
      "applicability": {
        "configurationIds": [
          "lexus-gs300-jzs160-2000-us-lhd"
        ],
        "engineVariantIds": [
          "2jz-ge-vvti-jzs160"
        ]
      },
      "oemPartNumber": {
        "value": null,
        "status": "not-established",
        "sourceIds": [
          "lexus-epc"
        ]
      },
      "dimensions": {
        "status": "estimated",
        "sourceIds": [
          "wrenchwise-layout-estimate",
          "lexus-uk-gs300-1997-spec"
        ],
        "items": [
          {
            "key": "length",
            "value": 0.6,
            "unit": "m",
            "method": "photo-proportion"
          },
          {
            "key": "width",
            "value": 0.34,
            "unit": "m",
            "method": "photo-proportion"
          },
          {
            "key": "height",
            "value": 0.135,
            "unit": "m",
            "method": "photo-proportion"
          },
          {
            "key": "camAxisY",
            "value": 0.375,
            "unit": "m",
            "method": "photo-proportion"
          },
          {
            "key": "camSpacing",
            "value": 0.135,
            "unit": "m",
            "method": "photo-proportion"
          }
        ]
      },
      "placement": {
        "status": "estimated",
        "frame": "engine",
        "position": [
          0,
          0.3425,
          -0.3
        ],
        "axis": "z",
        "sourceIds": [
          "wrenchwise-layout-estimate"
        ]
      },
      "asset": {
        "layer": "core",
        "meshIds": [
          "cylinder-head"
        ]
      },
      "procedureStepIds": [],
      "sourceIds": [
        "photo-us-gs300-bay",
        "lexus-uk-vvti-cutaway",
        "wrenchwise-layout-estimate"
      ],
      "verification": {
        "identity": {
          "status": "photographic",
          "sourceIds": [
            "photo-us-gs300-bay",
            "lexus-uk-vvti-cutaway"
          ]
        },
        "dimensions": {
          "status": "estimated",
          "sourceIds": [
            "wrenchwise-layout-estimate"
          ]
        },
        "placement": {
          "status": "estimated",
          "sourceIds": [
            "wrenchwise-layout-estimate"
          ]
        },
        "fitment": {
          "status": "not-established",
          "sourceIds": []
        },
        "procedure": {
          "status": "not-applicable",
          "sourceIds": []
        }
      },
      "gaps": [
        "Camshaft spacing is estimated."
      ]
    },
    {
      "id": "cylinder-head-covers",
      "name": "Cylinder head covers",
      "description": "Intake-side and exhaust-side covers grouped as one record.",
      "system": "engine-structure",
      "parentId": "cylinder-head",
      "kind": "group",
      "quantity": {
        "value": 1,
        "status": "mirror-derived",
        "sourceIds": [
          "rm718u-mirror-em",
          "photo-us-gs300-bay"
        ]
      },
      "applicability": {
        "configurationIds": [
          "lexus-gs300-jzs160-2000-us-lhd"
        ],
        "engineVariantIds": [
          "2jz-ge-vvti-jzs160"
        ]
      },
      "oemPartNumber": {
        "value": null,
        "status": "not-established",
        "sourceIds": [
          "lexus-epc"
        ]
      },
      "dimensions": {
        "status": "estimated",
        "sourceIds": [
          "wrenchwise-layout-estimate",
          "lexus-uk-gs300-1997-spec"
        ],
        "items": [
          {
            "key": "length",
            "value": 0.56,
            "unit": "m",
            "method": "photo-proportion"
          },
          {
            "key": "width",